"Item type","Authors","Title","Journal","Publication year","Volume","Issue","Pages","Edition","Publisher","Address","Proceedings title","Conference location","Date published","ISBN","ISSN","URLs","DOI","Abstract","Keywords","Notes","Sub-type","Series"
"Book","Tak R,Modi J","Mobile DevOps: Deliver Continuous Integration and Deployment within Your Mobile Applications","","2018","","","","","Packt Publishing","","","","2018","9781788296243","","","","This step-by-step guide will teach you to continuously improve your mobile application development process Key Features Efficiently deliver continuous integration and deployment within all the stages of your application's lifecycle Learn to implement mobile DevOps with Xamarin and Visual Studio Deliver high quality and performing mobile applications Book Description Today's world is all about perfection, and there are hundreds of applications that are released each day out of which only a few succeed. Making sure that the app looks, performs, and behaves as expected is one of the biggest challenge developers face today. The main goal of this book is to teach developers to implement DevOps to build, test, and deliver. This book will teach you to implement Mobile DevOps at every stage of your application's lifecycle with Visual Studio and Xamarin Mobile Lifecycle solutions. Later, it will also show you how to leverage Mobile Center's continuous integration and automated testing to develop a high-quality applications. Next, you'll see how to mobilize your on-premises data to the cloud and increase your productivity with code reuse. Finally, you'll discover how to find and fix bugs beforehand, improving the efficiency of your application while it is being developed. By the end of this book, you will be well-versed with Mobile DevOps techniques, delivering high quality and high performance mobile apps. What you will learnBecome fluent with the basic components of Mobile DevopsFind out how to use code repositories and install Git on an EC2 server and manage users and groups Set up an Android device for development and install Visual Studio and Xamarin on Windows Create an Android project and UI for applications Add permissions to Android Manifest Write tests with Xamarin. UI and test using test cloud to check it on multiple devices Monitor and optimize the application using the Android monitoring tool Debug the mobile application and improve its efficiency Who This Book Is ForIf you are a programmer and developer who wants to increase the efficiency and scalability of your mobile application with the implementation of DevOps, then this book is for you. You need basic experience of the application process development.","","","",""
"Conference Paper","Guerriero M,Ciavotta M,Gibilisco GP,Ardagna D","SPACE4Cloud: A DevOps Environment for Multi-Cloud Applications","","2015","","","29–30","","Association for Computing Machinery","New York, NY, USA","Proceedings of the 1st International Workshop on Quality-Aware DevOps","Bergamo, Italy","2015","9781450338172","","https://doi-org.proxy.bnl.lu/10.1145/2804371.2804378;http://dx.doi.org/10.1145/2804371.2804378","10.1145/2804371.2804378","Cloud computing has been a game changer in the design, development and management of modern applications, which have grown in scope and size becoming distributed and service oriented. New methodologies have emerged to deal with this paradigm shift in software engineering. Consequently, new tools, devoted to ease the convergence between developers and other IT professional, are required. Here, we present SPACE4Cloud, a DevOps integrated environment for model-driven design-time QoS assessment and optimization, and runtime capacity allocation for Cloud applications.","DevOps, QoS, Cloud, Model-Driven, runtime, design-time","","","QUDOS 2015"
"Conference Paper","Pourmajidi W,Miranskyy A,Steinbacher J,Erwin T,Godwin D","Dogfooding: Using IBM Cloud Services to Monitor IBM Cloud Infrastructure","","2019","","","344–353","","IBM Corp.","USA","Proceedings of the 29th Annual International Conference on Computer Science and Software Engineering","Toronto, Ontario, Canada","2019","","","","","The stability and performance of Cloud platforms are essential as they directly impact customers' satisfaction. Cloud service providers use Cloud monitoring tools to ensure that rendered services match the quality of service requirements indicated in established contracts such as service-level agreements.Given the enormous number of resources that need to be monitored, highly scalable and capable monitoring tools are designed and implemented by Cloud service providers such as Amazon, Google, IBM, and Microsoft. Cloud monitoring tools monitor millions of virtual and physical resources and continuously generate logs for each one of them. Considering that logs magnify any technical issue, they can be used for disaster detection, prevention, and recovery. However, logs are useless if they are not assessed and analyzed promptly. Thus, we argue that the scale of Cloud-generated logs makes it impossible for DevOps teams to analyze them effectively. This implies that one needs to automate the process of monitoring and analysis (e.g., using machine learning and artificial intelligence). If the automation will witness an anomaly in the logs --- it will alert DevOps staff.The automatic anomaly detectors require a reliable and scalable platform for gathering, filtering, and transforming the logs, executing the detector models, and sending out the alerts to the DevOps staff. In this work, we report on implementing a prototype of such a platform based on the 7-layered architecture pattern, which leverages micro-service principles to distribute tasks among highly scalable, resources-efficient modules. The modules interact with each other via an instance of the Publish-Subscribe architectural pattern. The platform is deployed on the IBM Cloud service infrastructure and is used to detect anomalies in logs emitted by the IBM Cloud services, hence the dogfooding. In particular, we leverage IBM Cloud Functions to deploy the computing modules, IBM Event Streams to establish communication among the modules, and IBM Cloud Object Storage and IBM Cloudant for persistent storage.The prototype efficiency is promising: it takes the platform 17 seconds or less from the point of receiving a new log record to emitting an alert to the IBM Cloud DevOps team.","","","","CASCON '19"
"Conference Paper","Daoudagh S,Lonetti F,Marchetti E","Continuous Development and Testing of Access and Usage Control: A Systematic Literature Review","","2020","","","51–59","","Association for Computing Machinery","New York, NY, USA","Proceedings of the 2020 European Symposium on Software Engineering","Rome, Italy","2020","9781450377621","","https://doi-org.proxy.bnl.lu/10.1145/3393822.3432330;http://dx.doi.org/10.1145/3393822.3432330","10.1145/3393822.3432330","Context: Development and testing of access/usage control systems is a growing research area. With new trends in software development such as DevOps, the development of access/usage control also has to evolve. Objective: The main aim of this paper is to provide an overview of research proposals in the area of continuous development and testing of access and usage control systems. Method: The paper uses a Systematic Literature Review as a research method to define the research questions and answer them following a systematic approach. With the specified search string, 210 studies were retrieved. After applying the inclusion and exclusion criteria in two phases, a final set of 20 primary studies was selected for this review. Results: Results show that primary studies are mostly published in security venues followed by software engineering venues. Furthermore, most of the studies are based on the standard XACML access control language. In addition, a significant portion of the proposals for development and testing is automated with test assessment and generation the most targeted areas. Some general guidelines for leveraging continuous developing and testing of the usage and access control systems inside the DevOps process are also provided.","XACML, Systematic Literature Review, Testing, Access Control, DevOps","","","ESSE 2020"
"Book","Limoncelli TA,Chalup SR,Hogan CJ","The Practice of Cloud System Administration: Designing and Operating Large Distributed Systems, Volume 2","","2014","","","","1st","Addison-Wesley Professional","","","","2014","9780321943187","","","","Theres an incredible amount of depth and thinking in the practicesdescribed here, and its impressive to see it all in one place. Win Treese, coauthor of Designing Systems for Internet Commerce The Practice of Cloud System Administration, Volume 2, focuses on distributed or cloud computing and brings a DevOps/SRE sensibility to the practice of system administration. Unsatisfied with books that cover either design or operations in isolation, the authors created this authoritative reference centered on a comprehensive approach. Case studies and examples from Google, Etsy, Twitter, Facebook, Netflix, Amazon, and other industry giants are explained in practical ways that are useful to all enterprises. The new companion to the best-selling first volume, The Practice of System and Network Administration, Second Edition, this guide offers expert coverage of the following and many other crucial topics: Designing and building modern web and distributed systems Fundamentals of large system design Understand the new software engineering implications of cloud administration Make systems that are resilient to failure and grow and scale dynamically Implement DevOps principles and cultural changes IaaS/PaaS/SaaS and virtual platform selection Operating and running systems using the latest DevOps/SRE strategies Upgrade production systems with zero down-time What and how to automate; how to decide what not to automate On-call best practices that improve uptime Why distributed systems require fundamentally different system administration techniques Identify and resolve resiliency problems before they surprise you Assessingand evaluating your teams operational effectiveness Manage thescientific process of continuous improvement A forty-page, pain-free assessment system you can start using today","","","",""
"Conference Paper","McCarthy MA,Herger LM,Khan SM,Belgodere BM","Composable DevOps: Automated Ontology Based DevOps Maturity Analysis","","2015","","","600–607","","IEEE Computer Society","USA","Proceedings of the 2015 IEEE International Conference on Services Computing","","2015","9781467372817","","https://doi-org.proxy.bnl.lu/10.1109/SCC.2015.87;http://dx.doi.org/10.1109/SCC.2015.87","10.1109/SCC.2015.87","In this era of the emerging digitized, mobilized, and cloudified enterprises, the concept of the ""compos able business"" is the most critical piece which ties everything together. The digital enterprise is here, and its prime characteristic is that is essentially detaches and segregates existing businesses and reassembles them according to market demands. Every industry, from transportation to eyewear is up for disruption, and developers are in the forefront of this movement. In turn, these developers are under intense pressure to accelerate time to market. The compos able enterprise approach requires a reconsideration of traditional models of the entire IT organization. These organization and their processes need to be broken up into components that follow certain key design principles such as The Minimal Functions with least Dependencies, portability, Shared Knowledge, Predictable Contracts and Maximized Human Value. The last three bullet points encapsulate the very definition of DevOps [3]. The concept of better integration between Development and Operations is a valuable objective. The goal is to foster measurable incremental cultural change to derive most overall value out of the union of people, process and technology. But the cultural issues, reward models, and risk allocation create obvious barriers in attaining those goals. The common industry belief is to use the compos able enterprise framework to build a platform using the right tools and you will have attained DevOps nirvana. In this paper we will explore valuable lessons learned from our mistakes in tool centric adoption of IT Infrastructure Library (ITIL) [8]. We will also show how we applied those lessons to develop a lightweight compos able/contextual DevOps framework that learns and measure itself to avoid those cultural pitfalls.","deontic, semantic, maturity, devops, itil, ontology","","","SCC '15"
"Book","Forsgren N,Humble J,Kim G","Accelerate: The Science of Lean Software and DevOps Building and Scaling High Performing Technology Organizations","","2018","","","","1st","IT Revolution Press","","","","2018","9781942788331","","","","Accelerate your organization to win in the marketplace. How can we apply technology to drive business value? For years, we've been told that the performance of software delivery teams doesn't matterthat it can't provide a competitive advantage to our companies. Through four years of groundbreaking research to include data collected from the State of DevOps reports conducted with Puppet, Dr. Nicole Forsgren, Jez Humble, and Gene Kim set out to find a way to measure software delivery performanceand what drives itusing rigorous statistical methods. This book presents both the findings and the science behind that research, making the information accessible for readers to apply in their own organizations. Readers will discover how to measure the performance of their teams, and what capabilities they should invest in to drive higher performance. This book is ideal for management at every level.","","","",""
"Book","Sawhney R","Beginning Azure Functions: Building Scalable and Serverless Apps","","2019","","","","1st","Apress","USA","","","2019","9781484244432","","","","Create highly scalable apps and monitor Azure functions in production using Azure Functions 2.0. This book takes you through durable functions for statefulness and covers not only the basics, but also how to create bindings in durable functions. It is a deep dive into the Azure Functions serverless API and will guide you through the process of converting monolithic applications to use Azure functions. The author starts by giving an overview of serverless architecture and Azure functions along with Azure App Services. You will then learn to create basic Azure functions using the Azure portal and Visual Studio. Next, you will create a serverless API using Azure Functions and migrate an existing application to Azure Functions. Finally, you will deploy an Azure function and monitor it in production. Here you will deploy the Azure function using ARM templates and secure and configure CORS for Azure functions. After reading this book, you will be able to understand Azure functions and create them using the Azure portal and Visual Studio. What You Will Learn Understand and use triggers and bindings in an Azure function Create a serverless API using Azure Functions and OpenAPI Deploy an Azure function and monitor it in production Understand durable Azure functions, including scalability, disaster recovery, and geo-distribution Who This Book Is ForDevelopers who want to get started with Azure Functions. DevOps will also find value in the guidance for deploying and monitoring functions.","","","",""
"Conference Paper","Islam MS,Pourmajidi W,Zhang L,Steinbacher J,Erwin T,Miranskyy A","Anomaly Detection in a Large-Scale Cloud Platform","","2021","","","150–159","","IEEE Press","Virtual Event, Spain","Proceedings of the 43rd International Conference on Software Engineering: Software Engineering in Practice","","2021","9780738146690","","https://doi-org.proxy.bnl.lu/10.1109/ICSE-SEIP52600.2021.00024;http://dx.doi.org/10.1109/ICSE-SEIP52600.2021.00024","10.1109/ICSE-SEIP52600.2021.00024","Cloud computing is ubiquitous: more and more companies are moving the workloads into the Cloud. However, this rise in popularity challenges Cloud service providers, as they need to monitor the quality of their ever-growing offerings effectively. To address the challenge, we designed and implemented an automated monitoring system for the IBM Cloud Platform. This monitoring system utilizes deep learning neural networks to detect anomalies in near-real-time in multiple Platform components simultaneously.After running the system for a year, we observed that the proposed solution frees the DevOps team's time and human resources from manually monitoring thousands of Cloud components. Moreover, it increases customer satisfaction by reducing the risk of Cloud outages.In this paper, we share our solutions' architecture, implementation notes, and best practices that emerged while evolving the monitoring system. They can be leveraged by other researchers and practitioners to build anomaly detectors for complex systems.","","","","ICSE-SEIP '21"
"Conference Paper","Kontogiannis K,Amyot D,Mylopoulos J","Software Techniques for Engineering Cyber-Physical Systems","","2021","","","289–290","","IBM Corp.","USA","Proceedings of the 31st Annual International Conference on Computer Science and Software Engineering","Toronto, Canada","2021","","","","","Cyber-Physical Systems (CPSs) refer to systems comprising software components, physical components, and social entities which monitor, control, and coordinate processes within a physical environment. CPSs apply to a wide range of mission-critical applications that span from the intelligent management of logistics in complex supply chains, advanced manufacturing systems, and smart contracts, all the way to autonomous systems, and systems that support the smart interactions between humans and machines (M2H), or between machines (M2M). In this respect, the engineering of CPSs goes beyond existing Software Engineering concepts, tools, and techniques because of the very nature of CPSs that spans three realms (cyber, physical, social) and therefore needs to address requirements that span these realms. During the workshop, the participants discussed and debated techniques and directions in six main thematic areas on engineering Cyber-Physical Systems. These thematic areas deal with specification and modeling, DevOps processes for CPSs, data management and analytics, infrastructure and event handling, run-time adaptivity, and finally security, trust, and traceability.","process metrics, software repositories, fault-proneness prediction, continuous software engineering","","","CASCON '21"
"Journal Article","Ali N,Daneth H,Hong J","A Hybrid DevOps Process Supporting Software Reuse: A Pilot Project","J. Softw. Evol. Process","2020","32","7","","","John Wiley & Sons, Inc.","USA","","","2020-07","","2047-7473","https://doi-org.proxy.bnl.lu/10.1002/smr.2248;http://dx.doi.org/10.1002/smr.2248","10.1002/smr.2248","Large software development organizations manage reusable software components through a reusable software repository in order to reduce development time and cost and to improve software quality and productivity. This paper presents a hybrid DevOps process with a systematic reuse‐based software development and management process to reduce the effort and cost required for the rework and to increase productivity. The proposed approach promotes the systematic reuse of software components based on both information retrieval and ontology‐based retrieval techniques. The reusable assets are presented in different styles to ease and support the reuse process with fine‐grained reusable artifacts. To evaluate our proposed process, a pilot project, aiming to monitor the health of a patient, was developed and monitored the reuse activities throughout the whole experiment. The results revealed that our proposed process got an average gain of 35.2% in terms of developed function points by reusing 30.63% of reusable artifacts available in the reuse repository.We proposed a hybrid DevOps process with a systematic reuse‐based software development and management process to reduce the effort and cost required for the rework and to increase productivity. DevOps encourage tool support during the software delivery process for quick delivery. Therefore, we have developed a reuse repository to support rapid delivery by reusing artifacts during the development process. A pilot project—a health‐monitoring and management application—was developed to evaluate our proposed hybrid DevOps process. image","software development process, software reuse, reuse repository, DevOps","","",""
"Conference Paper","Castellanos C,Varela CA,Correal D","Measuring Performance Quality Scenarios in Big Data Analytics Applications: A DevOps and Domain-Specific Model Approach","","2019","","","165–172","","Association for Computing Machinery","New York, NY, USA","Proceedings of the 13th European Conference on Software Architecture - Volume 2","Paris, France","2019","9781450371421","","https://doi-org.proxy.bnl.lu/10.1145/3344948.3344986;http://dx.doi.org/10.1145/3344948.3344986","10.1145/3344948.3344986","Big data analytics (BDA) applications use advanced analysis algorithms to extract valuable insights from large, fast, and heterogeneous data sources. These complex BDA applications require software design, development, and deployment strategies to deal with volume, velocity, and variety (3vs) while sustaining expected performance levels. BDA software complexity frequently leads to delayed deployments, longer development cycles and challenging performance monitoring. This paper proposes a DevOps and Domain Specific Model (DSM) approach to design, deploy, and monitor performance Quality Scenarios (QS) in BDA applications. This approach uses high-level abstractions to describe deployment strategies and QS enabling performance monitoring. Our experimentation compares the effort of development, deployment and QS monitoring of BDA applications with two use cases of near mid-air collisions (NMAC) detection. The use cases include different performance QS, processing models, and deployment strategies. Our results show shorter (re)deployment cycles and the fulfillment of latency and deadline QS for micro-batch and batch processing.","performance quality scenarios, domain specific model, software architecture, big data analytics, DevOps","","","ECSA '19"
"Book","Meyler K,Buchanan S,Scholman M,Svendsen JG,Rangama J","Microsoft Hybrid Cloud Unleashed with Azure Stack and Azure","","2017","","","","1st","Sams publishing","","","","2017","9780672338502","","","","Microsoft Hybrid Cloud Unleashed brings together comprehensive and practical insights into hybrid cloud technologies, complete CloudOps and DevOps implementation strategies, and detailed guidance for deploying Microsoft Azure Stack in your environment. Written by five Microsoft Cloud and Datacenter Management MVPs, this book is built on real-world scenarios and the authors extraordinary hands-on experiences as early adopters. Step by step, the authors help you integrate your optimal mix of private and public cloud, with a unified management experience that lets you move workloads at will, achieving unprecedented flexibility. The authors also guide you through all aspects of building your own secure, high-performance hybrid cloud infrastructure. Youll discover how Azure Stack enables you to run data centers with the same scalability, redundancy, and reliability as Microsofts Azure data centers; how to integrate Azure infrastructure and platform services with internal operations; and how to manage crucial external dependencies. The book concludes with a deep dive into automating and customizing Azure Stack for maximum reliability, productivity, and cost savings. Detailed information on how to Run a private/hybrid cloud on your hardware in your data center, using APIs and code identical to public Azure Apply ITIL and DevOps lifecycles to your hybrid cloud implementation Gain a deep understanding of Azure Stack architecture, components, and internals Install and configure Azure Stack and master the Azure Stack Portal Integrate and utilize infrastructure, core, and custom resource providers Effectively provision, secure, and manage tenants Manage, monitor, troubleshoot, and back up Azure Stack with CloudOps Automate resource provisioning with PowerShell, the Azure CLI, templates, and Azure Stacks API Write your own Azure Resource Manager templates Centrally automate cloud management and complex tasks connected to external systems Develop customized, production-ready Azure Stack marketplace items","","","",""
