"Item type","Authors","Title","Journal","Publication year","Volume","Issue","Pages","Edition","Publisher","Address","Proceedings title","Conference location","Date published","ISBN","ISSN","URLs","DOI","Abstract","Keywords","Notes","Sub-type","Series"
"Book","Rossberg J,Olausson M","Pro Application Lifecycle Management with Visual Studio 2012","","2012","","","","2nd","Apress","USA","","","2012","9781430243441","","","","You can have the best coders in the world working in your teams, but if your project management isnt up to scratch, your project is almost certain to be delayed, to come in over budget, and in some cases to fail entirely. By taking precise control of your application development process, you can make changes, both large and small, throughout your projects life cycle that will lead to betterquality finished products that are consistently delivered on time and within budget. Application lifecycle management (ALM) is an area of rapidly growing interest within the development community. Because its techniques allow you to deal with the process of developing applications across many areas of responsibility and across many different disciplines, its effects on your project can be wide ranging and pronounced. It is a project management tool that has practical implications for the whole teamfrom architects to designers, from developers to testers. Pro Application Lifecycle Management with Visual Studio 2012focuses on the most powerful ALM tool available for the Microsoft .NET Framework: Visual Studio Team Foundation Server. It demonstrates the key concepts and techniques of ALM at first with a guide to the overall methodology, and then delves into architecture and testing--illustrating all of the concepts, tips and tricks using the tools TFS provides. The book serves as a complete guide to the ALM style--with no fluff and many relevant code samples and examples. After reading the book, you will understand how TFS can be used to generate continuous meaningful reporting on your projects health for the decision makers on your team as well as for your projects sponsors. What youll learn What ALM is and what it can do for you How to achieve traceability in your projects How to improve your development process Why TFS is so much more than just a version control tool The new features in TFS that help encourage ALM best practices, especially within Metro and .NET 4.5 applications What the importance of welldesigned and welldefined processes is and how to implement these things Who this book is for This book will be of value for anyone developing applications with Visual Studio Team Foundation Server, whether they are working in a small team of just a few people or in a large enterprise environment. Table of Contents Why Application Lifecycle Management Matters Introduction to Application Lifecycle Management Development Processes and Frameworks ALM Assessments Working with TFS to Enhance the ALM Process Introduction to Agile Planning Work Item Tracking and Process Customization Agile Project Management with TFS Metrics and ALM Assessment Prototyping/Storyboarding + Feedback Tracking Top Down Design Studies (UML) Using Architecture Explorer Using Layer Diagrams Metrics and ALM Assessment Version Control Unit Testing Code Analysis, Code Metrics, Code Clones, Code Review Performance and Profiling Metrics and ALM Assessment Overview of Software Testing Manual Testing Automated Testing Test Lab Management Metrics and ALM Assessment Continuous Delivery Build Automation Deployment Release Management Metrics and ALM Assessment Architecture, Implementation and Planning Installation, Migration and Administration TFS Reporting Working in Heterogeneous Environments TFS in the Cloud","","","",""
"Book","Kim G,Debois P,Willis J,Humble J","The DevOps Handbook: How to Create World-Class Agility, Reliability, and Security in Technology Organizations","","2016","","","","","IT Revolution Press","","","","2016","9781942788003","","","","Increase profitability, elevate work culture, and exceed productivity goals through DevOps practices. More than ever, the effective management of technology is critical for business competitiveness. For decades, technology leaders have struggled to balance agility, reliability, and security. The consequences of failure have never been greaterwhether it's the healthcare.gov debacle, cardholder data breaches, or missing the boat with Big Data in the cloud. And yet, high performers using DevOps principles, such as Google, Amazon, Facebook, Etsy, and Netflix, are routinely and reliably deploying code into production hundreds, or even thousands, of times per day. Following in the footsteps of The Phoenix Project, The DevOps Handbook shows leaders how to replicate these incredible outcomes, by showing how to integrate Product Management, Development, QA, IT Operations, and Information Security to elevate your company and win in the marketplace. Take the DORA DevOps X-ray Assessment and see where you stand! Visit devops-survey.com with your access code to take the DevOps X-ray Assessment.","","","",""
"Conference Paper","Morales JA,Yasar H,Volkman A","Implementing DevOps Practices in Highly Regulated Environments","","2018","","","","","Association for Computing Machinery","New York, NY, USA","Proceedings of the 19th International Conference on Agile Software Development: Companion","Porto, Portugal","2018","9781450364225","","https://doi-org.proxy.bnl.lu/10.1145/3234152.3234188;http://dx.doi.org/10.1145/3234152.3234188","10.1145/3234152.3234188","In this paper, we discuss implementing DevOps practices in highly regulated environments (HREs). DevOps has become a standard option for entities seeking to streamline and increase participation by all stakeholders in their Software Development Lifecycle (SDLC). For a large portion of industry, academia, and government, applying DevOps is a straight forward process. There is, however, a subset of entities in these three sectors where applying DevOps can be very challenging. These are entities mandated by policies to conduct all or a portion of their SDLC activities in HREs. Often, the reason for an HRE is general security and protection of intellectual property. Even if an entity is functioning in a highly regulated environment, its SDLC can still benefit from implementing DevOps as long as the implementation conforms to all imposed policies. In this paper, we discuss the process of performing a DevOps assessment and implementation in an HRE which we refer to as HRE-DevOps.","DevOps, highly regulated environment, secure DevOps, SDLC, DevOps assessment","","","XP '18"
"Book","Cuppett MS","DevOps, DBAs, and DBaaS: Managing Data Platforms to Support Continuous Integration","","2016","","","","1st","Apress","USA","","","2016","9781484222072","","","","Learn how DBAs in a DevOps environment manage data platforms and change requests to support and optimize continuous integration, delivery, testing, and deployment in the application development life cycle. On the Dev side, DBAs evaluate change requests to ensure compliance with organizational best practices and guard against degradation of database performance and the validity of dependent objects. On the Ops side, DBAs perform release and troubleshooting activities in support of the application, manage the data platforms access and security, and monitor and maintain performance of the databases that they have designed and provisioned. DevOps, DBAs, and DBaaS investigates the complex intersection between DBA functions and DevOps processes. DevOps teams traditionally viewed DBAs as process outliers who disrupt and retard SDLC timelines. At each touch point, veteran DBA Mike Cuppett shows how DBAs can most effectively contribute to decreasing release cycle times and improving product resiliency by applying automation, orchestration, and DBaaS solutions to database administration in ways that dovetail with DevOps requirements and metrics. At a high level, Cuppett demonstrates the importance of leveling silo walls in the IT supply chain and of measuring application performance holistically by reference to satisfaction of customer requirements and end-user experience. At a technical level, he drills into topics and case studies on diagnosing and resolving problems commonly encountered by DBAs and DevOps teams when meshing database management with application delivery. What You Will Learn:Understand techniques and best practices at all points of collaboration between DBAs and DevOps teams in product developmentUse tools for measuring DBA inputs to DevOps processes by holistic criteria of end-user experience and business requirementIntegrate open source database technologies with DevOpsKnow when to decouple application and database layers and move to DBaaS modelsOvercome language and mindset barriers between DBAs and DevOps teamsWho This Book Is For:DBAs who are leaning toward or already involved with DevOps and DevOps engineers, team leaders, developers and product managers who are already working with DBAs or planning to integrate DBAs in DevOps teams. The secondary readership is executives and managers in companies that practice DevOps.","","","",""
"Journal Article","Bennett BT","Shifting Traditional Undergraduate Software Engineering Instruction to a DevOps Focus","J. Comput. Sci. Coll.","2021","36","5","129–138","","Consortium for Computing Sciences in Colleges","Evansville, IN, USA","","","2021-01","","1937-4771","","","Classical Software Engineering education often includes traditional methodologies that do not adequately describe today's industry practice. DevOps is a culture that promotes fast delivery, continuous feedback, and an environment of learning. Its non-linear path requires a shift in software engineering pedagogy. This case study describes the redevelopment of a second-semester course in software engineering to focus on DevOps principles. The study evaluates student performance using formative and summative assessment through a team project tracked throughout the semester and final exam results. Results indicated that students developed DevOps skills during the course, but may have needed more reinforcement of some traditional Software Engineering topics.","","","",""
"Conference Paper","van Deursen A","Software Engineering without Borders","","2017","","","3","","IEEE Press","Urbana-Champaign, IL, USA","Proceedings of the 32nd IEEE/ACM International Conference on Automated Software Engineering","","2017","9781538626849","","","","DevOps approaches software engineering by advocating the removal of borders between development and operations. DevOps emphasizes operational resilience, continuous feedback from operations back to development, and rapid deployment of features developed. In this talk we will look at selected (automation) aspects related to DevOps, based on our collaborations with various industrial partners. For example, we will explore (automated) methods for analyzing log data to support deployments and monitor REST API integrations, (search-based) test input generation for reproducing crashes and testing complex database queries, and zero downtime database schema evolution and deployment. We will close by looking at borders beyond those between development and operations, in order to see whether there are other borders we need to remove in order to strengthen the impact of software engineering research.","","","","ASE 2017"
"Book","Leonard A","Data Integration Life Cycle Management with SSIS: A Short Introduction by Example","","2017","","","","1st","Apress","USA","","","2017","9781484232750","","","","Build a custom BimlExpress framework that generates dozens of SQL Server Integration Services (SSIS) packages in minutes. Use this framework to execute related SSIS packages in a single command. You will learn to configure SSIS catalog projects, manage catalog deployments, and monitor SSIS catalog execution and history. Data Integration Life Cycle Management with SSISshows you how to bring DevOps benefits to SSIS integration projects. Practices in this book enable faster time to market, higher quality of code, and repeatable automation. Code will be created that is easier to support and maintain. The book teaches you how to more effectively manage SSIS in the enterprise environment by drawing on the art and science of modern DevOps practices. What You'll Learn Generate dozens of SSIS packages in minutes to speed your integration projects Reduce the execution of related groups of SSIS packages to a single command Successfully handle SSIS catalog deployments and their projects Monitor the execution and history of SSIS catalog projects Manage your enterprise data integration life cycle through automated tools and utilities Who This Book Is For Database professionals working with SQL Server Integration Services in enterprise environments. The book is especially useful to those readers following, or wishing to follow, DevOps practices in their use of SSIS.","","","",""
"Book","Davis J,Daniels R","Effective DevOps: Building a Culture of Collaboration, Affinity, and Tooling at Scale","","2016","","","","1st","O'Reilly Media, Inc.","","","","2016","9781491926307","","","","Some companies think that adopting devops means bringing in specialists or a host of new tools. With this practical guide, youll learn why devops is a professional and cultural movement that calls for change from inside your organization. Authors Katherine Daniels and Jennifer Davis provide several approaches for improving collaboration within teams, creating affinity among teams, promoting efficient tool usage in your company, and scaling up what works throughout your organizations inflection points. Devops stresses iterative efforts to break down information silos, monitor relationships, and repair misunderstandings that arise between and within teams in your organization. By applying the actionable strategies in this book, you can make sustainable changes in your environment regardless of your level within your organization. Explore the foundations of devops and learn the four pillars of effective devopsEncourage collaboration to help individuals work together and build durable and long-lasting relationships Create affinity among teams while balancing differing goals or metrics Accelerate cultural direction by selecting tools and workflows that complement your organization Troubleshoot common problems and misunderstandings that can arise throughout the organizational lifecycleLearn from case studies from organizations and individuals to help inform your own devops journey","","","",""
"Book","Palermo J","..NET DevOps for Azure: A Developer's Guide to DevOps Architecture the Right Way","","2019","","","","1st","Apress","USA","","","2019","9781484253427","","","","Use this book as your one-stop shop for architecting a world-class DevOps environment with Microsoft technologies. .NET DevOps for Azure is a synthesis of practices, tools, and process that, together, can equip a software organization to move fast and deliver the highest quality software. The book begins by discussing the most common challenges faced by developers in DevOps today and offers options and proven solutions on how to implement DevOps for your team. Daily, millions of developers use .NET to build and operate mission-critical software systems for organizations around the world. While the marketplace has scores of information about the technology, it is completely up to you to put together all the blocks in the right way for your environment. This book provides you with a model to build on. The relevant principles are covered first along with how to implement that part of the environment. And while variances in tools, language, or requirements will change the needed implementation, the DevOps model is the architecture for the working environment for your team. You can modify parts of the model to customize it to your enterprise, but the architecture will enable all of your teams and applications to accelerate in performance. What You Will Learn Get your .NET applications into a DevOps environment in Azure Analyze and address the part of your DevOps process that causes delays or bottlenecks Track code using Azure Repos and conduct acceptance tests Apply the rules for segmenting applications into Git repositories Understand the different types of builds and when to use each Know how to think about code validation in your DevOps environment Provision and configure environments; deploy release candidates across the environments in Azure Monitor and support software that has been deployed to a production environment Who This Book Is For .NET Developers who are using or want to use DevOps in Azure but don't know where to begin","","","",""
"Book","Hsu T","Hands-On Security in DevOps: Ensure Continuous Security, Deployment, and Delivery with DevSecOps","","2018","","","","","Packt Publishing","","","","2018","9781788995504","","","","Protect your organization's security at all levels by introducing the latest strategies for securing DevOps Key Features Integrate security at each layer of the DevOps pipeline Discover security practices to protect your cloud services by detecting fraud and intrusion Explore solutions to infrastructure security using DevOps principles Book Description DevOps has provided speed and quality benefits with continuous development and deployment methods, but it does not guarantee the security of an entire organization. Hands-On Security in DevOps shows you how to adopt DevOps techniques to continuously improve your organizations security at every level, rather than just focusing on protecting your infrastructure. This guide combines DevOps and security to help you to protect cloud services, and teaches you how to use techniques to integrate security directly in your product. You will learn how to implement security at every layer, such as for the web application, cloud infrastructure, communication, and the delivery pipeline layers. With the help of practical examples, youll explore the core security aspects, such as blocking attacks, fraud detection, cloud forensics, and incident response. In the concluding chapters, you will cover topics on extending DevOps security, such as risk assessment, threat modeling, and continuous security. By the end of this book, you will be well-versed in implementing security in all layers of your organization and be confident in monitoring and blocking attacks throughout your cloud services. What you will learn Understand DevSecOps culture and organization Learn security requirements, management, and metrics Secure your architecture design by looking at threat modeling, coding tools and practices Handle most common security issues and explore black and white-box testing tools and practices Work with security monitoring toolkits and online fraud detection rules Explore GDPR and PII handling case studies to understand the DevSecOps lifecycle Who this book is for Hands-On Security in DevOps is for system administrators, security consultants, and DevOps engineers who want to secure their entire organization. Basic understanding of Cloud computing, automation frameworks, and programming is necessary.","","","",""
"Conference Paper","Pietrantuono R,Bertolino A,De Angelis G,Miranda B,Russo S","Towards Continuous Software Reliability Testing in DevOps","","2019","","","21–27","","IEEE Press","Montreal, Quebec, Canada","Proceedings of the 14th International Workshop on Automation of Software Test","","2019","","","https://doi-org.proxy.bnl.lu/10.1109/AST.2019.00009;http://dx.doi.org/10.1109/AST.2019.00009","10.1109/AST.2019.00009","We introduce the DevOpRET approach for continuous reliability testing in DevOps. It leverages information monitored in operation to guide operational-profile based testing, which is conceived as part of the acceptance testing stage before each next release to production. We overview the envisaged test and monitoring pipeline, describe the approach and present a case-study evaluating how reliability assessment evolves over subsequent releases.","software reliability testing, quality gate, operational profile, acceptance test, DevOps","","","AST '19"
"Conference Paper","Guerriero M,Ciavotta M,Gibilisco GP,Ardagna D","A Model-Driven DevOps Framework for QoS-Aware Cloud Applications","","2015","","","345–351","","IEEE Computer Society","USA","Proceedings of the 2015 17th International Symposium on Symbolic and Numeric Algorithms for Scientific Computing (SYNASC)","","2015","9781509004614","","https://doi-org.proxy.bnl.lu/10.1109/SYNASC.2015.60;http://dx.doi.org/10.1109/SYNASC.2015.60","10.1109/SYNASC.2015.60","Recently we witnessed a deep transformation in the the design, development and management of modern applications, which have grown in scope and size becoming distributed and service-oriented. A big part in this metamorphosis is played by the Cloud with the availability of almost-infinite resources, high availability and outsourced maintenance. This has led to the emergence of new software development methodologies to effectively deal with this paradigm shift in the field of software engineering. DevOps is one of them, it advocates for a greater level of collaboration and convergence between developers and other IT professionals. Consequently, new tools, purposely designed to ease this process, are required. In this scenario, we present SPACE4Cloud, a DevOps integrated environment for model-driven design-time quality of service assessment and optimization, and runtime capacity allocation of Cloud applications.","","","","SYNASC '15"
"Book","Farcic V","The DevOps 2.2 Toolkit","","2018","","","","","Packt Publishing","","","","2018","9781788991278","","","","Learn from an expert on how use self-adapting and self-healing systems within Docker. Key Features Viktor Farcic shows you all aspects in the creation of self-adapting and self-healing systems in both a practical and hands-on approach. Learn how to choose a successful solution for metrics storage and query, including InfluxDB, Nagios and Sensu, Prometheus and Graphite. Discover how to integrate Docker Flow Monitor with Docker Flow Proxy. How to apply Docker self-healing and self-adaptive to both services and infrastructure. Book Description Building on The DevOps 2.0 Toolkit and The DevOps 2.1 Toolkit: Docker Swarm, Viktor Farcic brings his latest exploration of the Docker technology as he records his journey to explore two new programs, self-adaptive and self-healing systems within Docker. The DevOps 2.2 Toolkit: Self-Sufficient Docker Clusters is the latest book in Viktor Farcic's series that helps you build a full DevOps Toolkit. This book in the series looks at Docker, the tool designed to make it easier in the creation and running of applications using containers. In this latest entry, Viktor combines theory with a hands-on approach to guide you through the process of creating self-adaptive and self-healing systems. Within this book, Viktor will cover a wide-range of emerging topics, including what exactly self-adaptive and self-healing systems are, how to choose a solution for metrics storage and query, the creation of cluster-wide alerts and what a successful self-sufficient system blueprint looks like. Work with Viktor and dive into the creation of self-adaptive and self-healing systems within Docker. What you will learn Let Viktor Farcic show you all aspects in the creation of self-adapting and self-healing systems in both a practical and hands-on approach. Learn how to choose a successful solution for metrics storage and query, including InfluxDB, Nagios and Sensu, Prometheus and Graphite. Understand how to integrate Docker Flow Monitor with Docker Flow Proxy. The creation of cluster-wide alerts by creating alerts based on metrics. How to apply self-healing and self-adaptive to both services and infrastructure. Who this book is forThis book is for professionals experienced with Docker looking to create both self-adapting and self-healing systems using the software.","","","",""
