"Item type","Authors","Title","Journal","Publication year","Volume","Issue","Pages","Edition","Publisher","Address","Proceedings title","Conference location","Date published","ISBN","ISSN","URLs","DOI","Abstract","Keywords","Notes","Sub-type","Series"
"Journal Article","Royce W,Cantor M","Economic Governance of Software Delivery","IEEE Softw.","2014","31","1","54–61","","IEEE Computer Society Press","Washington, DC, USA","","","2014-01","","0740-7459","https://doi-org.proxy.bnl.lu/10.1109/MS.2013.102;http://dx.doi.org/10.1109/MS.2013.102","10.1109/MS.2013.102","Agility without objective governance cannot scale, and governance without agility cannot compete. Agile methods are mainstream, and software enterprises are adopting these practices in diverse delivery contexts and at enterprise scale. IBM's broad industry experience with agile transformations and deep internal know-how point to two key principles to deliver sustained improvements in software business outcomes with higher confidence: measure and streamline change costs, and steer with economic governance and Bayesian analytics. Applying these two principles in context is the crux of measured improvement in continuous delivery of smarter software-intensive systems. This article describes more meaningful measurement and prediction foundations for economic governance. The Web extra at http://youtu.be/ghAM8ifyeVI is a video in which Walker Royce, author, IEEE Software editorial board member, and IBM Chief Software Economist, describes how to reason about software delivery governance with lean principles.","measuring agility, steering leadership, Bayes methods, Bayesian analytics, Cognition, Economics, Software quality, Uncertainty, economic governance, Measurement uncertainty","","",""
"Journal Article","Perez-Palacin D,Merseguer J,Requeno JI,Guerriero M,Di Nitto E,Tamburri DA","A UML Profile for the Design, Quality Assessment and Deployment of Data-Intensive Applications","Softw. Syst. Model.","2019","18","6","3577–3614","","Springer-Verlag","Berlin, Heidelberg","","","2019-12","","1619-1366","https://doi-org.proxy.bnl.lu/10.1007/s10270-019-00730-3;http://dx.doi.org/10.1007/s10270-019-00730-3","10.1007/s10270-019-00730-3","Big Data or Data-Intensive applications (DIAs) seek to mine, manipulate, extract or otherwise exploit the potential intelligence hidden behind Big Data. However, several practitioner surveys remark that DIAs potential is still untapped because of very difficult and costly design, quality assessment and continuous refinement. To address the above shortcoming, we propose the use of a UML domain-specific modeling language or profile specifically tailored to support the design, assessment and continuous deployment of DIAs. This article illustrates our DIA-specific profile and outlines its usage in the context of DIA performance engineering and deployment. For DIA performance engineering, we rely on the Apache Hadoop technology, while for DIA deployment, we leverage the TOSCA language. We conclude that the proposed profile offers a powerful language for data-intensive software and systems modeling, quality evaluation and automated deployment of DIAs on private or public clouds.","Profile, Apache Hadoop, Big Data, TOSCA language, Performance assessment, Data-intensive applications, UML, Model-driven deployment, Software design","","",""
"Book","Smart JF","Jenkins: The Definitive Guide","","2011","","","","","O'Reilly Media, Inc.","","","","2011","9781449305352","","","","Streamline software development with Jenkins, the popular Java-based open source tool that has revolutionized the way teams think about Continuous Integration (CI). This complete guide shows you how to automate your build, integration, release, and deployment processes with Jenkinsand demonstrates how CI can save you time, money, and many headaches. Ideal for developers, software architects, and project managers, Jenkins: The Definitive Guide is both a CI tutorial and a comprehensive Jenkins reference. Through its wealth of best practices and real-world tips, you'll discover how easy it is to set up a CI service with Jenkins. Learn how to install, configure, and secure your Jenkins server Organize and monitor general-purpose build jobs Integrate automated tests to verify builds, and set up code quality reporting Establish effective team notification strategies and techniques Configure build pipelines, parameterized jobs, matrix builds, and other advanced jobs Manage a farm of Jenkins servers to run distributed builds Implement automated deployment and continuous delivery","","","",""
"Conference Paper","Bisegna A,Carbone R,Ranise S","Integrating A Pentesting Tool For IdM Protocols In A Continuous Delivery Pipeline","","2021","","","94–110","","Springer-Verlag","Berlin, Heidelberg","Emerging Technologies for Authorization and Authentication: 4th International Workshop, ETAA 2021, Darmstadt, Germany, October 8, 2021, Revised Selected Papers","Darmstadt, Germany","2021","9783030937461","","https://doi-org.proxy.bnl.lu/10.1007/978-3-030-93747-8_7;http://dx.doi.org/10.1007/978-3-030-93747-8_7","10.1007/978-3-030-93747-8_7","Identity Management (IdM) solutions are increasingly important for digital infrastructures of both enterprises and public administrations. Their security is a mandatory prerequisite for building trust in current and future digital ecosystems. IdM solutions are usually large-scale complex software systems maintained and developed by several groups of ICT professionals. Continuous Delivery (CD) pipeline is adopted to make maintenance, extension, and deployment of such solutions as efficient and repeatable as possible. For security, CD pipeline is also used as a continuous risk assessment to quickly evaluate the security impact of changes. Several tools have been developed and integrated in the CD pipeline to support this view in the so called DevSecOps approach with the notable exception of a tool for protocol pentesting and compliance against standards such as SAML 2.0, OAuth 2.0 and OpenID Connect. To fill this gap, we propose an approach to integrate Micro-Id-Gym—a tool for the automated pentesting of IdM deployments—in a CD pipeline. We report our experience in doing this and discuss the advantages of using the tool in the context of a joint effort with Poligrafico e Zecca dello Stato Italiano to build a digital identity infrastructure.","","","",""
"Conference Paper","Zhou P,Ali Khan AA,Liang P,Badshah S","System and Software Processes in Practice: Insights from Chinese Industry","","2021","","","394–401","","Association for Computing Machinery","New York, NY, USA","Evaluation and Assessment in Software Engineering","Trondheim, Norway","2021","9781450390538","","https://doi-org.proxy.bnl.lu/10.1145/3463274.3463786;http://dx.doi.org/10.1145/3463274.3463786","10.1145/3463274.3463786","Software development processes play a key role in the software and system development life cycle. Processes are becoming complex and evolve rapidly due to the modern-day continuous software engineering (CSE) concepts, which are mainly based on continuous integration, continuous delivery, infrastructure-as-code, automation and more. The fast growing Chinese software development industry adopts various processes to achieve potential benefits offered in the international market. This study is conducted with the aim to investigate the trends of processes in practice in the Chinese industry. The survey questionnaire data is collected from 34 practitioners working in software development firms across the China and the results highlight that iterative and agile processes are extensively used in industrial setting. Furthermore, agile and traditional approaches are combined to develop the hybrid processes. Most of the participants are satisfied using the current development processes, however, they show interest to continuously improve the existing process models and methods. Finally, we noticed that majority of the software development organizations used the ISO 9001 standard for process assessment and improvement activities. The given results provide preliminary overview of processes deployed in the Chinese industry.","Process Improvement Standards, Survey, Chinese industry, Software processes","","","EASE 2021"
"Conference Paper","Veeraragavan NR,Montecchi L,Nostro N,Bondavalli A,Vitenberg R,Meling H","Understanding the Quality of Experience in Modern Distributed Interactive Multimedia Applications in Presence of Failures: Metrics and Analysis","","2013","","","439–446","","Association for Computing Machinery","New York, NY, USA","Proceedings of the 28th Annual ACM Symposium on Applied Computing","Coimbra, Portugal","2013","9781450316569","","https://doi-org.proxy.bnl.lu/10.1145/2480362.2480450;http://dx.doi.org/10.1145/2480362.2480450","10.1145/2480362.2480450","Recent technological advances have made it possible to design bandwidth demanding distributed interactive multimedia applications such as the World Opera application. In this application artists from different opera houses across the globe, can participate in a single united performance and interact almost as if they were co-located.One of the main design challenges in this application domain is to determine the composition of system components necessary to satisfy the desired quality of service in presence of failures and budget constraints. This challenge is exacerbated by the fact that quality of service depends on a multitude of factors such as human perception of video and audio, the type of audience, performance elements, etc. These factors cannot be captured by traditional approaches for dependability evaluation such as reliability, i.e., continuous delivery of correct service. This calls for developing a more comprehensive ""Quality of Experience"" concept.In this paper, we propose a novel method to assess the quality of experience in presence of failures, based on a new metric called perceived reliability. This method can help the system designers and engineers compare architectural variants and to determine the dependability budget. We show the feasibility of our method by applying it to a World Opera performance. Our experimental results provide useful guidelines for system engineers towards improving the quality of experience of World Opera performances despite presence of failures.","reliability analysis, quality of experience, world opera, distributed interactive multimedia applications","","","SAC '13"
"Journal Article","Sabau AR,Hacks S,Steffens A","Implementation of a Continuous Delivery Pipeline for Enterprise Architecture Model Evolution","Softw. Syst. Model.","2021","20","1","117–145","","Springer-Verlag","Berlin, Heidelberg","","","2021-02","","1619-1366","https://doi-org.proxy.bnl.lu/10.1007/s10270-020-00828-z;http://dx.doi.org/10.1007/s10270-020-00828-z","10.1007/s10270-020-00828-z","The discipline of enterprise architecture (EA) is an established approach to model and manage the interaction of business processes and IT in an organization. Thereby, the EA model as a central artifact of EA is subject to a continuous evolution caused by multiple sources of changes. The continuous evolution requires a lot of effort in controlling and managing the evolution of the EA model. This is especially true when merging the induced changes from different sources in the EA model. Additionally, the lack of tool and automation support makes this a very time-consuming and error-prone task. The evolutionary character and the automated quality assessment of artifacts is a well-known challenge in the software development domain as well. To meet these challenges, the discipline of continuous delivery (CD) has emerged to be very useful. The evolution of EA model artifacts shows similarities to the evolution of software artifacts. Therefore, we leveraged practices of CD to practices of EA maintenance. Thus, we created a conceptual framework for automated EA model maintenance. The concepts were realized in a first prototype and were evaluated in a fictitious case study against equivalence classes based on EA model metrics and a set of several requirements for automated EA model maintenance from research. Overall, the concepts prove to be a promising basis for further refinement, implementation, and evaluation in research in an industrial context.","Enterprise architecture model maintenance, Continuous delivery, Enterprise architecture model evolution","","",""
"Book","Pasquali S","Deploying Node.Js","","2015","","","","","Packt Publishing","","","","2015","9781783981403","","","","Learn how to build, test, deploy, monitor, and maintain your Node.js applications at scale About This BookGain comprehensive information on scaling Node.js both vertically and horizontally in the cloud and across virtual machinesLearn how to use Gulp, Mocha, Chai, PhantomJS, Git, Browserify, Docker, and other tools to construct a simple, fast, and intelligent build-and-deploy systemUtilize the easy-to-understand examples to explore data caching strategies, application monitoring tips and tricks, and other professional techniques that are useful for maintaining lightweight, fast, and robust applicationsWho This Book Is ForIf you are an intermediate or advanced developer deploying your Node.js applications, then this book is for you. If you have already built a Node application or module and want to take your knowledge to the next level, this book will help you find your way.What You Will LearnLearn the strengths of Node.js and how to optimize your code to make it ready for deployment into productionUse Docker and Vagrant to create many virtual instances of your Node.js applicationsDeploy Node.js repositories to the cloud using Heroku, OpenShift, and DigitalOceanUtilize native Node.js modules, or Nginx, to load balance your applicationsOptimize your Node runtime by tweaking V8, managing memory intelligently, and using Redis to manage state dataDiscover how to use Gulp, Browserify, npm, Mocha, Chai, Sinon, and other tools to simplify your build/test/release processManage your production deployments with Git, Jenkins, and AnsibleIn DetailNode.js is a popular choice for teams that need to design, build, test, deploy, maintain, and monitor large-scale distributed systems. Starting with a detailed overview of the Node.js architecture, this book covers topics that will help in application development, testing, deployment, and maintenance.You will learn about concurrency, event loops, callbacks and streams. Furthermore, step-by-step instructions on deploying applications to providers such as DigitalOcean and Heroku will be provided, including information on setting up load balancers and proxies. Message queues and other techniques for managing state and session data at scale will also be covered.A series of examples on deploying your Node.js applications in production environments are provided, including a discussion on setting up continuous deployment and integration for your team. Popular tools for testing, deploying, building, and monitoring Node.js applications are covered, helping you get up and running quickly.","","","",""
"Book","Krochmalski J","Docker and Kubernetes for Java Developers: Scale, Deploy, and Monitor Multi-Container Applications","","2017","","","","","Packt Publishing","","","","2017","9781786468390","","","","Key Features Master using Docker and Kubernetes to build, deploy and manage Java applications in a jiffLearn how to create your own Docker image and customize your own cluster using Kubernetes Empower the journey from development to production using this practical guide. Book Description Imagine creating and testing Java EE applications on Apache Tomcat Server or Wildfly Application server in minutes along with deploying and managing Java applications swiftly. Sounds too good to be true? But you have a reason to cheer as such scenarios are only possible by leveraging Docker and Kubernetes. This book will start by introducing Docker and delve deep into its networking and persistent storage concepts. You will then proceed to learn how to refactor monolith application into separate services by building an application and then packaging it into Docker containers. Next, you will create an image containing Java Enterprise Application and later run it using Docker. Moving on, the book will focus on Kubernetes and its features and you will learn to deploy a Java application to Kubernetes using Maven and monitor a Java application in production. By the end of the book, you will get hands-on with some more advanced topics to further extend your knowledge about Docker and Kubernetes. What you will learn Package Java applications into Docker images Understand the running of containers locally Explore development and deployment options with Docker Integrate Docker into Maven builds Manage and monitor Java applications running on Kubernetes clusters Create Continuous Delivery pipelines for Java applications deployed to Kubernetes About the Author Jaroslaw Krochmalski is a passionate software designer and developer who specializes in the financial business domain. He has over 12 years' experience in software development. He is a clean-code and software craftsmanship enthusiast. He is a Certified Scrum Master and a fan of Agile. His professional interests include new technologies in web application development, design patterns, enterprise architectures, and integration patterns. He has been designing and developing software professionally since 2000 and has been using Java as his primary programming language since 2002. In the past, he worked for companies such as Kredyt Bank (KBC) and Bank BPS on many large-scale projects such as international money orders, express payments, and collection systems. He currently works as a consultant at Danish company 7N as an infrastructure architect for the Nykredit bank. You can reach him via Twitter at @jkroch or by e-mail at jarek@finsys.pl.","","","",""
"Book","Traukina A,Thomas J,Tyagi P,Reddipalli K","Industrial Internet Application Development: Simplify IIoT Development Using the Elasticity of Public Cloud and Native Cloud Services","","2018","","","","","Packt Publishing","","","","2018","9781788298599","","","","Your one-stop guide to designing, building, managing, and operating Industrial Internet of Things (IIoT) applications Key Features Build IIoT applications and deploy them on Platform as a Service (PaaS) Learn data analytics techniques in IIoT using Spark and TensorFlow Understand and combine Predix services to accelerate your development Book Description The Industrial Internet refers to the integration of complex physical machines with networked sensors and software. The current growth in the number of sensors deployed in heavy machinery and industrial equipment will lead to an exponential increase in data being captured that needs to be analyzed for predictive analytics. This also opens up a new avenue for developers who want to build exciting industrial applications. Industrial Internet Application Development serves as a one-stop guide for software professionals wanting to design, build, manage, and operate IIoT applications. You will develop your first IIoT application and understand its deployment and security considerations, followed by running through the deployment of IIoT applications on the Predix platform. Once you have got to grips with what IIoT is, you will move on to exploring Edge Development along with the analytics portions of the IIoT stack. All this will help you identify key elements of the development framework, and understand their importance when considering the overall architecture and design considerations for IIoT applications. By the end of this book, you will have grasped how to deploy IIoT applications on the Predix platform, as well as incorporate best practices for making fault-tolerant and reliable IIoT systems. What you will learn Connect prototype devices to Cloud Store data in IIoT applications Explore data management techniques and implementation Study IIoT applications analytics using Spark ML and TensorFlow Deploy analytics and visualize the outcomes as Alerts Understand continuous deployment using Docker and Cloud Foundry Make your applications fault-tolerant and monitor them with New Relic Understand IIoT platform architecture and implement IIoT applications on the platform Who this book is for This book is intended for software developers, architects, product managers, and executives keen to gain insights into Industrial Internet development. A basic knowledge of any popular programming language such as Python will be helpful.","","","",""
"Book","Pouclet R","Pro IOS Continuous Integration","","2014","","","","1st","Apress","USA","","","2014","9781484201251","","","","Pro iOS Continuous Integration teaches you how to utilize the strengths of continuous integration in your everyday work. CI is more popular now than ever, as iOS developers realize how time-consuming building and deploying an application for testing purposes and quality assurance can be. This book shows you how to make your developing life easier, with real-world applications and examples. With this book, you will learn what continuous integration and continuous delivery really are and how they can be used in your iOS projects. You will learn how to release an iOS application outside the App Store using Xcode. You'll understand how to leverage the power of the command line to build your projects, and run your tests. You'll use Jenkins and Bamboo to architect automatic builds and automate the whole build process. In addition, you'll also learn how to use Xcode server and bots, what quality assurance tools can be used to measure the quality of your code, and how to send builds to your beta testers. Author Romain Pouclet provides hands-on, practical experience in iOS continuous integration and, using this book, you will see that it's not actually that hard to set up a fully-featured continuous integration platform, whether you are an independent iOS developer working from home or a member of a team in a big company. What youll learn Learn what continuous integration really is and how you can benefit from it Use Xcode to develop and release an application without the app store Stop wasting time tracking environment related bugs Automate the execution of unit and functional tests Use quality insurance tools to track bugs and other misconceptions Who this book is for Pro iOS Continuous Integration is for iOS developers who are working from home or as a member of a team in a large company, who want to learn how to implement continuous integration into their workflow. If you are struggling to understand the widespread info that's currently available - this book succinctly brings the available tools and workflows together in one, easy-to-understand volume.","","","",""
"Book","Oliveira J,Bruchet M","Learning ASP.NET Core 2.0: Build Modern Web Apps with ASP.NET Core 2.0, MVC, and EF Core 2","","2017","","","","","Packt Publishing","","","","2017","9781788476638","","","","Learn how web applications can be built efficiently using ASP.NET Core 2.0 and related frameworks Key Features Get to grips with the new features and APIs introduced in ASP.NET Core 2.0Leverage the MVC framework and Entity Framework Core 2 to build efficient applications Learn to deploy your web applications in new environments such as the cloud and DockerBook DescriptionThe ability to develop web applications that are highly efficient but also easy to maintain has become imperative to many businesses. ASP.NET Core 2.0 is an open source framework from Microsoft, which makes it easy to build cross-platform web applications that are modern and dynamic. This book will take you through all of the essential concepts in ASP.NET Core 2.0, so you can learn how to build powerful web applications. The book starts with a brief introduction to the ASP.NET Core framework and the improvements made in the latest release, ASP.NET Core 2.0. You will then build, test, and debug your first web application very quickly. Once you understand the basic structure of ASP.NET Core 2.0 web applications, you'll dive deeper into more complex concepts and scenarios. Moving on, we'll explain how to take advantage of widely used frameworks such as Model View Controller and Entity Framework Core 2 and you'll learn how to secure your applications. Finally, we'll show you how to deploy and monitor your applications using Azure, AWS, and Docker. After reading the book, you'll be able to develop efficient and robust web applications in ASP.NET Core 2.0 that have high levels of customer satisfaction and adoption. What you will learnSet up your development environment using Visual Studio 2017 and Visual Studio CodeCreate a fully automated continuous delivery pipeline using Visual Studio Team ServicesGet to know the basic and advanced concepts of ASP.NET Core 2.0 with detailed examplesBuild an MVC web application and use Entity Framework Core 2 to access data Add Web APIs to your web applications using RPC, REST, and HATEOAS Authenticate and authorize users with built-in ASP.NET Core 2.0 features Use Azure, Amazon Web Services, and Docker to deploy and monitor your applications Who This Book Is For This book is for developers who would like to build modern web applications with ASP.NET Core 2.0. No prior knowledge of ASP.NET or .NET Core is required. However, basic programming knowledge is assumed. Additionally, previous Visual Studio experience will be helpful but is not required, since detailed instructions will guide through the samples of the book. This book can also help people, who work in infrastructure engineering and operations, to monitor and diagnose problems during the runtime of ASP.NET Core 2.0 web applications.","","","",""
